{
  "schema_version": "0.2.0",
  "kind": "seed_cell",
  "cell_id": "0c6a1f2e-7d3b-5a4c-8e9f-1b2c3d4e5f60",
  "source": {"source_type": "usage", "source_id": "example-usage@synthetic"},
  "task": {"l1": null, "l2": null, "taxonomy_version": "t0.1", "classifier": null},
  "model": {"provider": "example", "id": "example-model-b"},
  "method": {"harness": null},
  "period": {"start": "2026-09-01", "end": "2026-09-07"},
  "metrics": {"kind": "usage", "tokens": 1250000000, "share": 0.083, "rank": 4},
  "privacy": {"content_included": false, "identifiers_included": false}
}
